{
  "mappingResultID": "example",
  "status": "MAPPED",
  "projectedState": {
    "stateID": "example",
    "coordinates": [
      0,
      0,
      0,
      0,
      0,
      0,
      0,
      0,
      0
    ],
    "sourceReference": "example",
    "canonicalHash": "example"
  },
  "dimensionBindings": [
    {
      "dimensionID": "b0",
      "sourcePointers": [
        {
          "pointer": "/system/state",
          "tokens": [],
          "pointsToMissing": true,
          "pointsToNull": true
        }
      ],
      "mappingRule": "example",
      "evidence": [
        {}
      ],
      "diagnosticReference": {
        "diagnosticID": "example",
        "chainRootReference": "example",
        "diagnosticKind": "STATE_VALIDITY",
        "ruleReferences": [
          {
            "ruleID": "ASH-STATE-VALIDITY-001",
            "sourceReference": "example",
            "ruleFamily": "example"
          }
        ]
      }
    },
    {
      "dimensionID": "b0",
      "sourcePointers": [
        {
          "pointer": "/system/state",
          "tokens": [],
          "pointsToMissing": true,
          "pointsToNull": true
        }
      ],
      "mappingRule": "example",
      "evidence": [
        {}
      ],
      "diagnosticReference": {
        "diagnosticID": "example",
        "chainRootReference": "example",
        "diagnosticKind": "STATE_VALIDITY",
        "ruleReferences": [
          {
            "ruleID": "ASH-STATE-VALIDITY-001",
            "sourceReference": "example",
            "ruleFamily": "example"
          }
        ]
      }
    },
    {
      "dimensionID": "b0",
      "sourcePointers": [
        {
          "pointer": "/system/state",
          "tokens": [],
          "pointsToMissing": true,
          "pointsToNull": true
        }
      ],
      "mappingRule": "example",
      "evidence": [
        {}
      ],
      "diagnosticReference": {
        "diagnosticID": "example",
        "chainRootReference": "example",
        "diagnosticKind": "STATE_VALIDITY",
        "ruleReferences": [
          {
            "ruleID": "ASH-STATE-VALIDITY-001",
            "sourceReference": "example",
            "ruleFamily": "example"
          }
        ]
      }
    },
    {
      "dimensionID": "b0",
      "sourcePointers": [
        {
          "pointer": "/system/state",
          "tokens": [],
          "pointsToMissing": true,
          "pointsToNull": true
        }
      ],
      "mappingRule": "example",
      "evidence": [
        {}
      ],
      "diagnosticReference": {
        "diagnosticID": "example",
        "chainRootReference": "example",
        "diagnosticKind": "STATE_VALIDITY",
        "ruleReferences": [
          {
            "ruleID": "ASH-STATE-VALIDITY-001",
            "sourceReference": "example",
            "ruleFamily": "example"
          }
        ]
      }
    },
    {
      "dimensionID": "b0",
      "sourcePointers": [
        {
          "pointer": "/system/state",
          "tokens": [],
          "pointsToMissing": true,
          "pointsToNull": true
        }
      ],
      "mappingRule": "example",
      "evidence": [
        {}
      ],
      "diagnosticReference": {
        "diagnosticID": "example",
        "chainRootReference": "example",
        "diagnosticKind": "STATE_VALIDITY",
        "ruleReferences": [
          {
            "ruleID": "ASH-STATE-VALIDITY-001",
            "sourceReference": "example",
            "ruleFamily": "example"
          }
        ]
      }
    },
    {
      "dimensionID": "b0",
      "sourcePointers": [
        {
          "pointer": "/system/state",
          "tokens": [],
          "pointsToMissing": true,
          "pointsToNull": true
        }
      ],
      "mappingRule": "example",
      "evidence": [
        {}
      ],
      "diagnosticReference": {
        "diagnosticID": "example",
        "chainRootReference": "example",
        "diagnosticKind": "STATE_VALIDITY",
        "ruleReferences": [
          {
            "ruleID": "ASH-STATE-VALIDITY-001",
            "sourceReference": "example",
            "ruleFamily": "example"
          }
        ]
      }
    },
    {
      "dimensionID": "b0",
      "sourcePointers": [
        {
          "pointer": "/system/state",
          "tokens": [],
          "pointsToMissing": true,
          "pointsToNull": true
        }
      ],
      "mappingRule": "example",
      "evidence": [
        {}
      ],
      "diagnosticReference": {
        "diagnosticID": "example",
        "chainRootReference": "example",
        "diagnosticKind": "STATE_VALIDITY",
        "ruleReferences": [
          {
            "ruleID": "ASH-STATE-VALIDITY-001",
            "sourceReference": "example",
            "ruleFamily": "example"
          }
        ]
      }
    },
    {
      "dimensionID": "b0",
      "sourcePointers": [
        {
          "pointer": "/system/state",
          "tokens": [],
          "pointsToMissing": true,
          "pointsToNull": true
        }
      ],
      "mappingRule": "example",
      "evidence": [
        {}
      ],
      "diagnosticReference": {
        "diagnosticID": "example",
        "chainRootReference": "example",
        "diagnosticKind": "STATE_VALIDITY",
        "ruleReferences": [
          {
            "ruleID": "ASH-STATE-VALIDITY-001",
            "sourceReference": "example",
            "ruleFamily": "example"
          }
        ]
      }
    },
    {
      "dimensionID": "b0",
      "sourcePointers": [
        {
          "pointer": "/system/state",
          "tokens": [],
          "pointsToMissing": true,
          "pointsToNull": true
        }
      ],
      "mappingRule": "example",
      "evidence": [
        {}
      ],
      "diagnosticReference": {
        "diagnosticID": "example",
        "chainRootReference": "example",
        "diagnosticKind": "STATE_VALIDITY",
        "ruleReferences": [
          {
            "ruleID": "ASH-STATE-VALIDITY-001",
            "sourceReference": "example",
            "ruleFamily": "example"
          }
        ]
      }
    }
  ],
  "ambiguities": [],
  "diagnosticReferences": [
    {
      "diagnosticID": "example",
      "chainRootReference": "example",
      "diagnosticKind": "STATE_VALIDITY",
      "ruleReferences": [
        {
          "ruleID": "ASH-STATE-VALIDITY-001",
          "sourceReference": "example",
          "ruleFamily": "example"
        }
      ]
    }
  ]
}
